{
  "issue_or_system": "Community-scale hydrogen production using bio-inspired catalyst materials.",
  "current_signals": [
    "Public funding for green hydrogen pilots",
    "Electrochemical catalyst research is becoming more interdisciplinary"
  ],
  "historical_constraints": [
    "Hydrogen infrastructure has safety and storage barriers",
    "Catalyst scale-up often fails outside controlled lab settings"
  ],
  "aspirational_vision": "Distributed low-carbon energy production that communities can inspect and govern."
}
